{"$schema":"https://json-schema.org/draft/2020-12/schema","title":"WorkerReceipt","type":"object","required":["owner","status","commit","changed","checks","result","blockers","dependencies_unlocked","proposals"],"properties":{"owner":{"type":"string","minLength":1},"status":{"enum":["complete","blocked","failed"]},"commit":{"type":"string","minLength":1},"changed":{"type":"array","items":{"type":"string"}},"checks":{"type":"array","items":{"type":"string"}},"result":{"type":"string","minLength":1},"blockers":{"type":"array","items":{"type":"string"}},"dependencies_unlocked":{"type":"array","items":{"type":"string"}},"proposals":{"type":"array","items":{"type":"string"}}},"additionalProperties":false}
