{
  "blockers": [],
  "changed": [
    "data/bibliography_shards/B2.json",
    "sources/manifests/bibliography_B2.json",
    "sources/manifests/audit_B2.json",
    "generated/receipts/B2A.json"
  ],
  "checks": [
    "C5 auditor cache-only replay: 36/36 PASS, 0 FAIL",
    "fresh PG3026 RDF fetched and parsed: title North of Boston, creator Frost, Robert, language en, rights Public domain in the USA.",
    "PG3026 plain-text endpoint HTTP 200, UTF-8 decode, nonempty, SHA256 recorded in manifest",
    "30 accepted + 6 reserves and 36 unique IDs/source URLs preserved",
    "target-only source edition repair from PG21437 to PG3026",
    "bibliography audit tests: 23 passed",
    "no full text or non-authorized files changed"
  ],
  "commit": "HEAD",
  "dependencies_unlocked": [
    "B2-text-ready"
  ],
  "owner": "B2T",
  "proposals": [],
  "result": "B2 text-bearing edition repair green",
  "status": "complete"
}
