{
  "owner": "ChatGPT",
  "status": "complete",
  "commit": "edd3b01dd56794f4ea3480a4e9b9668f8fd639d3",
  "changed": [
    "docs/KINETIC_COMPRESSION.md",
    "data/primitive_cards.json"
  ],
  "checks": [
    "Re-read the four already exposed accepted cards before adding new primitives.",
    "Re-mined Treasure Island, Dracula, The Woman in White, and Moby-Dick rather than expanding the bibliography.",
    "Kept excerpts under 25 words.",
    "Added multi-source evidence for Economy of Proof and Object State Compression.",
    "Read remote primitive_cards.json after the prior pass; new pass committed to research-swarm-wip."
  ],
  "result": "Kinetic compression is now durable in-repo as both a research lens and six accepted primitive cards. New primitives: Economy of Proof and Object State Compression.",
  "blockers": [],
  "dependencies_unlocked": [
    "Further kinetic-compression re-mining of already accepted works"
  ],
  "proposals": []
}
