{
  "blockers": [],
  "changed": ["tests/test_scaffold.py", "generated/receipts/C8.json"],
  "checks": ["python -m unittest tests.test_scaffold", "python -m unittest discover -s tests"],
  "commit": "pending",
  "dependencies_unlocked": ["canonical-data-safe-scaffold-test"],
  "owner": "foreman-integration",
  "proposals": [],
  "result": "pass: empty-data negative control uses explicit temporary fixtures",
  "status": "complete"
}
