{
  "owner": "C2-digital-edition-schema",
  "status": "complete",
  "commit": "PROSPECTIVE_HEAD_PACKET_C2",
  "changed": [
    "schemas/work_record.json",
    "story_brainstorm.py",
    "tools/validate_rights.py",
    "tools/validate_refs.py",
    "tests/test_engine.py",
    "generated/receipts/C2.json"
  ],
  "checks": [
    "python -m unittest discover -s tests -v (8 passed)",
    "python -m py_compile story_brainstorm.py tools/*.py",
    "python story_brainstorm.py works validate (NOT_READY exit 2)",
    "modern digital edition fixture READY; post-1929/unknown/unidentified translation/missing item identity rejected"
  ],
  "result": "pass",
  "blockers": [],
  "dependencies_unlocked": [
    "digital-schema-ready"
  ],
  "proposals": []
}
